{
  "blueprint_digest": "sha256:b0560db9485a826aca07e9caf2e1095921d331331ad20ab282bd402fb08b5846",
  "run_id": "gdm-wo2026128750a1-agent-memory-3",
  "schema": "figures-selection/v0",
  "slots": [
    {
      "asset": "fig-01",
      "role": "hero",
      "tweet": 1
    },
    {
      "asset": "fig-02",
      "role": "exhibit",
      "tweet": 2
    },
    {
      "asset": "fig-08",
      "role": "exhibit",
      "tweet": 3
    },
    {
      "asset": "fig-07",
      "role": "exhibit",
      "tweet": 3
    },
    {
      "asset": "fig-03",
      "role": "exhibit",
      "tweet": 4
    },
    {
      "asset": "fig-21",
      "role": "exhibit",
      "tweet": 5
    },
    {
      "asset": "fig-10",
      "role": "exhibit",
      "tweet": 6
    },
    {
      "asset": "fig-01",
      "role": "exhibit",
      "tweet": 7
    },
    {
      "asset": "fig-01",
      "role": "exhibit",
      "tweet": 8
    }
  ],
  "spec_digest": "sha256:66ece496e3ffdf0320139748c01bf3f0cfdbd6d501cdd828bed02551699bf407",
  "spec_version": 1
}
